unique_id	Level 2	alternative_names_clean
441	Aruba Certified Mobility Expert (ACMX)	Certified ACMX, Aruba Wireless Expert, ACMX, ACMP+ACMX., Aruba Mobility Expert, Aruba Network Mobility Expert, ACMP-ACMX, Aruba Certified Mobility Professional, ACMX Certification, Aruba Certified Expert in Mobility
442	Aruba Certified ClearPass Professional (ACCP)	AC ClearPass Professional, Aruba ACCP Exam, Aruba CPP Certification, Aruba Wireless Access Control Professional, Aruba ClearPass Professional, Certified ClearPass Specialist, Aruba Certified ClearPass Expert, Aruba Network Certified ClearPass Professional, AC ClearPass Expert, ACCP Certification, ACCP
443	Aruba Certified Design Professional (ACDP)	ACMP (Aruba Certified Mobility Professional) - Design Track, HPE6-A71 (Aruba Certified Mobility Professional Exam), Aruba Certified Designer, ACDX (Aruba Certified Design Expert), ACDP, Aruba WLAN Design Specialist, Aruba Design Professional, Aruba Wireless Network Design Certified, Aruba Network Design Expert, ACDS (Aruba Certified Design Specialist)
444	Aruba Certified Edge Professional (ACEP)	Aruba Certified Edge Specialist, ACESP, Aruba ACE Professional, ACEP, Aruba Network Engineer Certificate, Aruba Networking Certification, ACEP Certification, Aruba Edge Technology Certified Professional, Aruba Edge Expert, ACE Professional Certification
445	Aruba Certified Mobility Professional (ACMP)	Aruba Mobility Professional, ACMP Certification, ACMP Certified Engineer, ACMP Designation, Aruba Certified Wireless Engineer, ACMP, Aruba Wireless Professional, Aruba Certified Mobility Expert, Certified Mobility Professional (ACMP), Aruba Network Mobility Certification
446	Certified Broadcast Networking Technologist (CBNT)	CBNT Certification, Certified Broadcast Technologist, Broadcast Networking Technologist, Broadcast Network Technician Certification, CBNT Accreditation, Broadcasting Network Technology Specialist, Certified Broadcasting Specialist, CBNT, Certified Broadcast Network Engineer, CBNT Certified Expert, Broadcast Networking Professional
447	Certified Computer Examiner (CCE)	Certified Cyber Crime Examiner, Certified Digital Forensics Examiner, Computer Forensics Examiner Certification, Certified Computer Forensic Examiner, Certified Computer Evidence Specialist, CCE, CCE Certification, CCE Forensic Certification, Certified Forensic Computer Examiner, CCE Exam Credential, Digital Forensics Examiner Certification
448	Certified Electronics Technician by the ETA (CET)	Certified CET, Electronics Technician Certification by ETA, Electronics Tech Certified by ETA, CET Certificate Holder, ETA Certified Technician, CET Credential, Certified Electronics Tech, ETA Certified Electronics Technician, ETA CET Certification, CET
449	Certified Hardware Asset Management Professional (CHAMP)	CHAMP Certification, Certified HAM Professional, Hardware Asset Management Practitioner, Accredited Hardware Asset Manager, CHAMP Designation, CHAMP, Certified Asset Management Specialist, Hardware Asset Management Expert, Hardware Asset Management Professional, Certified Hardware Asset Analyst
450	Certified Information Systems Auditor (CISA)	CIS Auditor Accreditation, CISA Certification Program, Information Systems Auditor Certification, IS Audit Certified Professional, CISA, Certified Information Systems Audit Specialist, Certified IT Auditor, CISA Accreditation, Certified IS Auditor, CISA Certification
451	Certified Information Security Manager (CISM)	CISM, Certified IS Manager, CISM Professional, Certified Security Manager, Certified Information Security Manager, CISM Certification, CISM Credential, ISM Certification, IS Management Certification, Information Security Manager Certification
452	Certified Information Systems Security Professional (CISSP)	CISSP Credential, Information Systems Security Professional, Cybersecurity Expert, Certified Security Specialist, Cybersecurity Specialist, Certified Security Professional, CISSP Certification Holder, Certified InfoSec Professional, CISSP, CISSP Certification
453	Certified Information Technology Asset Manager (CITAM)	CITAM, IT Asset Management Certification, Information Technology Asset Manager Certification, Certified ITAM Specialist, CITAM Certification, Certified IT Asset Manager, ITAM Certification, CITAM Accreditation, CITAM Credential., Certified Asset Manager (IT), ITAM Professional Certification
454	Certified Internet Webmaster (CIW)	CIW Certification, Internet Webmaster Certification, CIW Certified Professional, Certified Web Developer, CIW Advanced HTML5 & CSS3 Specialist, CIW Website Manager, CIW Web Design Specialist, CIW Master Designer, Certified Internet Specialist (CIW), CIW, Webmaster Certification
455	Certified Software Asset Manager (CSAM)	Certified SAM Specialist, CSAM Practitioner, CSAM Qualified Professional, CSAM Accreditation, CSAM Certified Professional, CSAM, Certified SAM, Software Asset Manager Certification, Certified SAM Analyst, Software Asset Management Certification, Certified Software Asset Management Expert
456	Certified Software Developer Program (CSDP)	CSD Professional, Certified Software Engineer Program (CSEP), Certified Software Developer, CSD Program, Software Development Certification, CSDP Accreditation, Certified Application Developer., CSDP, Certified Developer Program, Software Developer Certification, Certified Programmer
457	Certified Software Tester (CSTE)	Certified Software Testing Professional, CSTE Software Tester, Software Testing Certification, Certified Tester (CSTE), CSTE Testing Expert, Certified Quality Assurance Specialist (CQAS), CSTE Certification, CSTE Accreditation, Software Quality Control Certification, CSTE, CSTE Exam Passer
458	Help Desk Institute (HDI)	HDI Customer Service Representative, HDI Certification, Help Desk Institute Certification, HDI Certified Support Center Analyst, HDI Desktop Support Technician, HDI Support Center Analyst, Helpdesk Institute Certification, HDI Technical Support Professional, HDI, HDI Service Desk Manager, HDI ITIL Foundation Certified
459	Internet and Computing Core Certification (IC3)	IC three Certification, ICCC Certification, IC3 Certification, IC³ Certification, IC^3 Certification, IC3 Computing Core Certification, IC-3 Certification, Internet and Computing Core Cert, IC3, Internet & Computing Core Certified
460	Certified Data Privacy Solutions Engineer (CDPSE)	CDPSE, Certified Privacy Engineer, Data Protection Engineer, CDPSE Certification, Certified Solutions Engineer (CDPSE), Privacy Solutions Engineer, CDPSE Accreditation, Data Privacy Solutions Engineer, Certified Data Privacy Professional, Data Privacy Specialist
461	ITIL 4 Foundation Level Certification	Certified in ITIL 4 Foundation, ITIL Framework Foundations Certification, ITIL Basic Certification, IT Infrastructure Library Foundation Level Certificate, ITIL Version 4 Foundation Exam, ITIL v4 Foundation, ITIL Certification Level 1, ITSM Foundation Certificate in ITIL 4, ITIL 4 Foundation, IT Service Management Foundation Certification
462	"Certified Cloud Security Professional (CCSP)
"	CCSP, Certified Cloud Security Practitioner, CCSP Training, Cloud Security Professional, Cloud Security Specialist, Certified Cloud Security Expert, CCSP Exam, Cloud Security Professional Certification, Certified Cloud Security Specialist, CCSP Certification
463	Certified Data Professional (CDP)	Certified Data Professional, Certified Data Scientist, Data Governance Certification, CDP Credential, Certified Database Administrator, Data Management Certification, CDP, Certified Data Analyst, Data Professional Certification, Certified Data Specialist
464	Certified Ethical Hacker (CEH)	Certified White Hat Hacker, Ethical Hacking Expert, CEH Certification, Ethical Hacker Certified, CEH Professional, EC-Council CEH, CEH Accreditation, Ethical Hacking Certification, CEH, Certified Hacker
465	Certified in Risk and Information Systems Control (CRISC)	Risk and Control Professional (RCP), Risk and Information Systems Control Certification, CRISC, CRISC Practitioner, Information Systems Risk Control Specialist, CRISC Exam Qualified, ISACA CRISC Certification, CRISC Accredited, CRISC Certified, Certified in Risk Management of Information Systems
466	VMware Certified Professional – Data Center Virtualization 2022 (VCP-DCV 2022)	VMware Data Center Virtualization Expert, VMware DCV Certified Professional, VMware Certified Professional - DCV 2022, VMware DCV Professional Certification, VMware Certified Data Center Virtualization Specialist, VCP Data Center Virtualization 2022, VCP-DCV 22 Certification, VCP-DCV Certification 2022, VCP-DCV 2022, VMware DCV Virtualization Engineer
