unique_id	Level 2	alternative_names_clean
290	Adobe Certified Associate (ACA)	ACA Certification, ACE (Adobe Certified Expert) Associate Level, Certified Adobe Associate, ACA, Adobe Certified Associate in (insert software name), Adobe Creative Cloud Certified Associate, Adobe ACA Certification, ACA InDesign Certification, Adobe Expert Certification, Adobe Design Specialist
291	Adobe Certified Expert (ACE) InDesign	Adobe ACE for InDesign, Adobe Certified InDesign Expert, Adobe Certified InDesign Specialist, InDesign Certified Expert, Adobe InDesign ACE, Certified InDesign Professional (ACE), Adobe Accredited Expert in InDesign, ACE, ACE-qualified in Adobe InDesign, ACE InDesign, InDesign Expert Certification
292	Adobe Certified Expert (ACE) Illustrator	Adobe Certification for Illustrator, Adobe Certified Expert Illustrator, Adobe ACE in Illustration, ACE for Adobe Illustrator proficiency, Illustrator ACE certification, Adobe ACE Illustrator, ACE, ACE Illustrator certification, Certified Expert in Adobe Illustrator, Adobe Illustrator Certified Expert, ACE in Adobe Illustrator
293	Adobe Certified Expert (ACE) Acrobat	Adobe Acrobat Pro Certification, Adobe Certified Expert in Acrobat Pro, ACE Adobe Acrobat Professional, ACE, Adobe Acrobat Certification, Certified ACE for Acrobat DC, ACE in Adobe Document Management, Adobe PDF Expert Certification, ACE Acrobat Specialist, Adobe Acrobat ACE, Adobe Certified Acrobat Expert
294	Adobe Certified Expert (ACE) Design Master	ACE Graphic Design Professional, ACE Design Master, ACE Expert in Design, ACE Master in Graphic Design., Adobe Design Master, ACE, Adobe Certified Designer Master Level, Adobe Design Specialist, ACE Design Certification, Adobe Certified Design Expert, Adobe Creative Suite Master
295	Adobe Certified Expert (ACE) Design Specialist	Adobe ACE Design Expert, ACE Design Specialist Certification, Adobe Design Certification, Adobe Certified Designer, Certified Adobe Design Specialist, Adobe Certified Expert in Design, ACE, ACE Design Professional, Adobe Creative Suite Design Expert, Adobe Graphic Design Certification, ACE Design Specialist
296	Adobe Certified Instructor (ACI) InDesign	ACI InDesign, Adobe Certified InDesign Expert, Adobe Certified Professional in InDesign, ACE (Adobe Certified Expert) in InDesign, ACI (Adobe Certified Instructor) for Desktop Publishing Using InDesign, ACI, Adobe InDesign Instructor Certification, Adobe InDesign Authorized Trainer Certification, Adobe Creative Cloud Certified Specialist in InDesign, Adobe InDesign Certified Trainer
297	Adobe Certified Instructor (ACI) Illustrator	Adobe Instructor Certification - Illustrator, ACE (Adobe Certified Expert) for Illustrator, ACI-IL (Adobe Certified Instructor – Illustrator), Adobe CC Certified Instructor - Illustrator, ACI (Adobe Certified Instructor) for Illustrator, ACI (Illustrator), ACI, ACI Illustrator, Adobe Certification - Illustrator Training, Adobe Certified Trainer - Illustrator, Adobe Certified Illustrator
298	Adobe Certified Instructor (ACI) Acrobat	ACI in Adobe Acrobat, Adobe ACE (Adobe Certified Expert) in Acrobat, Adobe Acrobat Training Certification, Certified Instructor for Adobe Acrobat, Adobe ACI Acrobat, ACI Acrobat Certification, Expert in Adobe Acrobat, ACI, Adobe Certified Acrobat Instructor, Certified Adobe Acrobat Trainer
299	Adobe Certified Instructor (ACI) Digital Publishing Suite	Adobe DPS Instructor Certification, ACI - Digital Publishing Specialist, ACI for Digital Publishing Suite, Adobe Certified Instructor for Digital Publishing, ACI Digital Publishing Suite Expert, ACI, Adobe DPS Certified Trainer, Certified Instructor for Adobe DPS, Adobe Digital Publishing Suite Training Certification, ACI in DPS Training and Certification, Adobe Certified Instructor (ACI) DPS
300	AWS Certified Solutions Architect - Associate	AWS Cloud Architect, AWS CSA - Associate, Certified Solutions Architect - Associate (AWS), Amazon Web Services Architecture Certification, AWS Certified Architect, AWS Associate Architect, Amazon Web Services Certified Solutions Architect - Associate, AWS Solutions Architect, AWS, AWS Solution Architecture Certification - Associate Level, AWS Solution Architect Associate
301	AWS DevOps Engineer	AWS DevOps Professional, AWS DevOps Certification, AWS Certified DevOps Engineer, Amazon Web Services DevOps Engineer Certification, AWS Certified Developer Operations Specialist, AWS Cloud DevOps Engineer Certification, Amazon DevOps Engineer Certification, AWS Developer Operations Engineer, AWS, AWS DevOps Specialist, Certified AWS DevOps Architect
302	AWS SysOps Administrator	AWS Ops Engineer, AWS SysAdmin, AWS Cloud Operations Engineer, AWS Administration Specialist, AWS System Operations Administrator, Certified Cloud Administrator, AWS, Amazon SysOps Architect, Amazon Web Services Administrator, Certified AWS SysOps Professional
303	AWS Developer	AWS DevOps Engineer (Developer Track), AWS Solutions Developer, AWS Cloud Developer, Amazon Developer Certification, Amazon Web Services Developer, AWS, Certified Amazon Web Services Application Developer, AWS Software Development Engineer (SDE), AWS Application Developer
304	AWS Cloud Practitioner	AWS Cloud Essentials, Certified AWS Cloud Professional, AWS Cloud Fundamentals, AWS Certified Solutions Architect - Associate, AWS Cloud Foundation, Amazon Cloud Practitioner, Amazon Web Services Cloud Specialist, AWS, AWS Cloud Associate, AWS Cloud Certified
305	Apple Certified Support Professional (ACSP) – macOS	Apple Support Professional, Apple Certified Mac Support Specialist, Apple Certified Support Associate (ACSA) – macOS, ACSP, Apple Mac Technician Certification, macOS Technical Specialist Certification, Apple Certified macOS Technician, ACSP – macOS Troubleshooting, macOS Certified Support Professional, ACSP – Mac Support Certification
306	Apple Certified Support Essentials 10.14 – macOS	macOS Support Specialist Certification, Apple Certified Support Professional, ACSE 10.14 - macOS, ACSP 10.14, Apple Certified Technical Coordinator (ACTC) - macOS 10.14, Apple Certified Support Associate - macOS, Apple Certified macOS Technician, Apple Mac Tech Certification, Apple Support Essentials Certification, ACDT 10.14 - macOS
307	Apple Certified Pro (for Final Cut Pro X and Logic Pro X)	Logic Pro X Certification, Apple Certified Specialist in Video Editing and Audio Production, Final Cut Pro X Certification, for Final Cut Pro X and Logic Pro X, Apple Pro Certification, Apple Certified Pro in Video Editing and Audio Production
308	AppleCare Service Certifications – ACMT & ACiT	ACMT & ACiT Certifications, Authorized Apple Repair Technician Accreditation - ACMT & ACiT, Apple Certified Mac Technician Certification, AppleCare Service Training, AppleCare Certifications, Apple Product Service Certifications - ACMT & ACiT, AppleCare Technical Certification - ACMT & ACiT, Apple Certified iOS Technician Certification, Apple Support Technician Certifications - ACMT & ACiT, ACMT and ACiT Training Programs
309	Cisco Certified Technicians (CCT)	CCT Certification, Cisco Technical Specialist, Certified CCT Professional, Cisco Field Technician, Cisco Support Engineer, CCT, Cisco Hardware Technician, CCT Network Engineer, Cisco Technician, Cisco Certified Tech
310	Cisco Certified Entry Networking Technician (CCENT)	Cisco Entry Level Certification, CCENT, Cisco Networking Technician, Cisco Network Technician, Entry Level Networking Technician, Cisco Certified Technician (CCT), CCENT Certification, CCENT Certified, Cisco Entry-Level Networking Certification, CCENT-Designated
311	Cisco Certified Network Associate (CCNA)	Cisco Certified Networking Associate, CCNA Qualification, Cisco CCNA Certification, Cisco Network Associate, CCNA, Cisco CCNA, Network Associate (CCNA), Cisco Certified Associate, CCNA Certified Professional, CCNA Certification
312	Cisco Certified Network Professional (CCNP)	CCNP Level Certification, Cisco Certified Network Pro, Cisco CCNP Certification, Cisco CCNP, CCNP, Certified Network Professional, CCNP Certification, Cisco Network Professional, Cisco Certified Professional, CCNP Routing and Switching
313	Cisco Certified Architect (CCAr)	CCAr Certification, Cisco Architect, Cisco Certified Architect, Cisco Network Architecture Professional, Certified Cisco Solutions Architect, CCIE Architect, Cisco Infrastructure Architect, Cisco Design Specialist, Cisco Architecture Expert, CCAr
314	Citrix Certified Expert – Virtualization (CCE-V)	Citrix Certified Virtualization Professional, Citrix Desktop Virtualization Expert, Citrix Virtualization Expert, Citrix Virtualization Guru, Citrix XenServer Expert, Citrix VDI Specialist, Citrix Certified XenDesktop Engineer – Virtualization (CCXD-V), CCE-V certified, CCE-V Certification, CCE-V, Citrix Certified Advanced Administrator – Virtualization (CCAA-V)
315	Citrix Certified Professional – Virtualization (CCP-V)	Citrix Virtualization Architect, Citrix Virtualization Professional, Citrix Certified Professional for Virtualization, Citrix VDI Specialist Certification, CCP-V Certification, CCP-V Credential, CCP-V, Citrix Certified Virtualization Expert, Certified Citrix Virtualization Specialist, Citrix Virtualization Engineer
316	Citrix Certified Associate – Virtualization (CCA-V)	Citrix Certified Virtualization Professional, CCA-Virtualization, CVA – Citrix Certified Virtualization Administrator, Citrix Virtualization Associate, Citrix Certified Associate in Virtualization, Citrix VDI Certification, CCA-V, Citrix Desktop Virtualization Certification
317	Citrix Certified Professional – Networking (CCP-N)	CCNP - Citrix Certified Professional – Networking, CCP-N Certification, Citrix Network Engineer, Citrix Networking Professional, CCP-N, Citrix Networking Specialist, Certified Citrix Networking Professional, CCA-N - Citrix Certified Associate – Networking, Citrix Networking Expert, Citrix Certified Network Associate
318	Citrix Certified Associate – Networking (CCA-N)	Certified Citrix Network Associate, CCA-N Certification, Citrix Certified Networking Professional, Citrix Network Administrator, CCA-N Exam, CCA-N, Citrix Networking Specialist, Citrix Networking Associate, Citrix Networking Expert, CCAN Certification, Citrix Certified Associate – Network Engineer (CCA-NE)
319	Citrix NetScaler SD-WAN Certified (CC-SDWAN)	CC-NS-SDWAN, Citrix SD-WAN Engineer, CC-NetScaler SD-WAN, Citrix NetScaler SD-WAN Specialist, CC-NSD, Citrix NetScaler WAN Optimization Certification, CC-SDWAN, Citrix NetScaler Certified - SD-WAN, Citrix SD-WAN Certification, Certified NetScaler SD-WAN Professional
320	Citrix Certified Professional – Mobility (CCP-M)	Citrix CCP-M, Citrix Mobility Administrator, Certified Citrix Mobility Expert, Citrix Certified Professional - Mobile Solutions, CCP-M Exam, CCP-M Certification, Certified Citrix Mobility Consultant, Citrix Mobility Professional, Citrix Mobility Engineer, Citrix Certified Mobility Specialist, CCP-M
321	Check Point Certified Security Administrator (CCSA) R80	CCSA R80 Certification, Check Point Firewall Administrator, Check Point Security Administrator, Check Point Network Security Admin (CCSA), CCSA Certified Professional, CCSA R80 Exam, Check Point R80 Security Administrator, Check Point Certified Administrator, CCSA, Check Point Firewall Expert
322	Check Point Certified Expert (CCSE) R80	Check Point CCSE R80, Check Point Security Expert R80, Check Point Certified Security Expert (CCSE) R80, CCSE, Certified Expert in Check Point Security (R80), CCSE-R80 Certification, Check Point Network Security Engineer (CCSE) R80, CCSE-R80 Exam Certification, Certified Professional in CheckPoint Security Engineering (R80), CheckPoint Advanced Security Engineer (CCSE) R80, CheckPoint CCSE R80 Credential
323	Check Point Certified Security Master (CCSM) R80	CCSM, Checkpoint Security Master Certification (CCSM), CCSE-R80, Check Point R80 Security Master, Check Point CCSM R80, Check Point Security Master, Check Point CCSM, Certified Security Master (CCSM), CCSM R80, CCSM Certification, Checkpoint Certified Security Master (CCSM) R80
324	A+	CompTIA PC Technician, IT Support Professional, CompTIA Certified Technician, A Plus, CompTIA Entry-Level Technician, CompTIA IT Fundamentals+
325	Project+	Plus in Project Management, Project Management+, Certified Project Professional, CompTIA Project Plus, PMI-Plus Certification, Project Management+ Certification, Certified Project Manager, Project Manager+, CompTIA Project Certification
326	Server+	Server Administrator Certification, Servers+, Certified Server Professional, Server Plus Certification, CompTIA Server Plus, Server Plus
327	Certified Technical Trainer (CTT+)	CTT+ Certified, Certified IT Trainer, CTT+, Technical Trainer Certification, Trainer Certification, Certified Technical Instructor (CTI), CTT+ Training Certification, Certified Instructional Technologist (CIT), Certified Trainer, CTT Plus, Certified Training Professional
328	Linux+	Linux Operating System Certification, CompTIA Certified Linux Administrator (CLA), Linux Plus, Linux Server Certification, LPI Certified Linux Administrator, LPIC-1, LX0-103 and LX0-104, Linux Administration Certification, Linux Professional
329	Cloud+	CompTIA Certified Cloud Professional, Advanced Cloud Computing Certification (ACCC), CompTIA CLO-001, Cloud Technology Expert, Cloud Essentials+, Cloud Plus, Certified Cloud Infrastructure Professional (CCIP), Cloud Computing Specialist
330	CloudEssentials+	Cloud Computing Essentials, Cloud Certification, Fundamentals of Cloud Computing, CompTIA Cloud Essentials, Cloud+, Cloud Technology Basics, Essential Cloud Knowledge, Cloud Essentials Plus, Basic Cloud Skills, Introduction to Cloud Computing
331	PenTest+	CREST Registered Tester, Offensive Security Certified Professional (OSCP), PT+, Certified Web Application Penetration Tester (CWAPT), Penetration Testing+, PenTesting+, ECPPT (Certified Professional Pentester), GIAC Penetration Tester (GPEN), CEH (Certified Ethical Hacker)
332	CASP+	CASP Certification, CASP Plus, CASP Plus Certification, CompTIA Advanced Security Expert, CompTIA Advanced Security Practitioner, CompTIA Advanced Security Professional, CompTIA Advanced Security Specialist
333	Network+	Network Professional, Networking+, Network Certification, Certified Network Associate, N+, CompTIA N+, Network Technician, Network Plus, Networking Certification
334	ITF+	Foundation level IT certification, Basic IT skills certification, IT Fundamentals+, Entry-level IT certification, IT Fundamentals Certification, ITF Plus, Beginner's IT certification, Introduction to IT certification, Core IT knowledge certification
335	CySA+	CySA Plus, CompTIA Cybersecurity Analyst+, CSA-Plus, Cybersecurity Analyst Certification, Cybersecurity Analyst+, CompTIA CSA+, CSA+ Certification, Cybersecurity Analyst Plus
336	Data+	Professional Data Analyst, Data Plus, Data Science Plus, Data Management+, Data Analytics+
337	DataSys+	Advanced DataSys Credential, Data Systems+, DataSys Plus, DataSys, Data Systems Plus, DataSys Specialist, Data Sys Plus, Data Sys+, Certified DataSys Professional, Data Management Certification+
338	EMCISA	EMC Storage Associate, EMCISM Certification, EMC Information Storage Administrator, EMC Storage and Management Professional, EMC ISM Associate, EMC Information Storage and Management Associate, EMC Data Storage and Management Specialist, EMC Information Storage Associate
339	EMCDS	EMC Data Scientist, Expert in EMC Data Science, EMC Analytics Engineer, EMC Data Science Specialist, EMC Data Science Practitioner, EMC Data Science Professional Certification
340	VCE-CIA	VCE-Certified IA, Certified Implementation Architect (CIA), VCE CIA, VCE Implementation Architecture Certification, Vblock CIA Certification, VCE Certified Implementation Architect, Implementing Vblock Solutions - Certified Implementation Architect (VCE CIA), Vblock Systems Administration Specialist
341	GSEC: GIAC Security Essentials	GSEC Exam Passer, GIAC Security Essentials Specialist, GIAC Information Security Professional (GSEC),  GIAC Certified, GSEC Credential Holder
342	GCIH: GIAC Certified Incident Handler	GCIH,  Certified in Incident Response and Recovery, GIAC Cybersecurity Certification - Incident Handler (GCIH)
343	GCIA: GIAC Certified Intrusion Analyst	GCIA Certification, Certified Network Intrusion Analyst, GIAC Intrusion Analyst, GIAC GCIA, GIAC Certified Analyst, GCIA Cybersecurity Certification, Certified Intrusion Analyst, Intrusion Analyst Certification, GIAC Intrusion Detection Expert., GCIA Certified Professional
344	GCFA: GIAC Certified Forensic Analyst	GCFA Cybersecurity Certification, GIAC Forensic Analyst, GIAC Certified Incident Handler - Forensics Focus (GCIH-GCFA), GCFA Certification, Cyber Forensic Analyst Certification, GIAC Incident Response and Forensics (GCFE), Digital Forensics Examiner (GCFA), GCFA Certified Expert, GIAC Digital Forensics Professional, Certified Forensic Analyst
345	GPEN: GIAC Penetration Tester	Advanced Penetration Testing (GPEN), GIAC Certified Penetration Tester, Cybersecurity Penetration Testing Expert (GPEN),  Certified Penetration Tester
346	GSLC: GIAC Security Leadership	GSLC Certified Expert in Security Leadership, GIAC Certified Security Leader, GIAC SL Certification,  Security Management Certification, Information Security Leadership Certified
347	GREM: GIAC Reverse Engineering Malware	GIAC GREM Certified, GIAC REM Specialist, Malware Reverse Engineering Certification, Advanced Malware Analysis Certification, GIAC Certified Reverse Engineer,  Reverse Engineering Malware, Certified Malware Analyst - GREM
348	GSNA: GIAC Systems and Network Auditor	GSEC,  GIAC Network Security Engineer
349	GCED: GIAC Certified Enterprise Defender	GIAC Enterprise Security Expert, GIAC Enterprise Defender, GCED, Certified GIAC Enterprise Defender, GIAC Security Professional - Enterprise Defender, GCED Certification, Certified Enterprise Defender, GIAC Certified Defense Expert, GCED Cybersecurity Certification, GCED Cyber Defense Certification
350	GCWN: GIAC Certified Windows Security Administrator	GCWN, GIAC Certified Windows Administrator,  GIAC Windows Admin
351	GPPA: GIAC Certified Perimeter Protection Analyst	GIAC PPA Certification, GIAC Certified Penetration Tester - Perimeter Protection Focus, Perimeter Protection Analyst Certification (GPPA), GPPA,  Perimeter Protection Analyst Certification
352	GPYC: GIAC Python Coder	 GIAC Python Programming Expert, GIAC GPYC, Certified Python Coder (GPYC)
353	GRID: GIAC Response and Industrial Defense	GIAC GRID Analyst, GRID Security Professional Certification, GIAC Incident Response and Industrial Defense Expert,  Industrial Defense Certified Professional, Industrial Defense Incident Responder Certification
354	Google Cloud Certification – Associate Cloud Architect	GCP Certified Cloud Architect, GCP Cloud Architect Certification, GCP ACE Certification, Google Cloud Professional - Associate Level, Google Cloud Platform Associate-Cloud-Architect Exam, Google Cloud Solutions Architect, GCP ACA Certification, Google Cloud Associate Architect, GCP Associate Cloud Engineer Certification, Google Certified Professional - Cloud Architect (Associate), GCP
355	Google Cloud Certification – Associate Cloud Developer	GCP - ACE (Associate Cloud Engineer) Certification, Google Certified - Associate Level in Cloud Development, GCP ACE Developer Certification, GCP Cloud Developer Certification, Google Certified Professional - Associate Level in Cloud Development, GCP Associate Cloud Developer, Google Cloud Developer, Associate Cloud Developer, GCP, Google Associate Cloud Development Certification, Google Cloud Certified - Associate Cloud Developer
356	Google Cloud Certification – Associate Data Engineer	GCP Associate DE Certification, GCP DE Certification, GCP ACE Certification, GCP Associate Data Engineering Certification, Associate Data Engineer, Google Cloud Certified - Associate DE, Google Cloud Data Engineering Associate Certification, Google Cloud Certified - Data Engineer, GCP, Google Cloud Data Engineer, Google Certified - Associate Data Engineer
357	Google Cloud Certification – Associate Cloud DevOps Engineer	Google Cloud Certified DevOps Professional, Google Associate - Cloud Developer/Operator Certification, Google Cloud Platform DevOps Engineer Certification, GCP Associate Cloud DevOps Engineer, Google Cloud Associate DevOps Engineer Certification, GCP Certified Associate for DevOps Engineering, Google Cloud DevOps Engineer, GCP Cloud DevOps Specialist, GCP, GCP Associate - Cloud Ops Engineer Certification
358	Google Cloud Certification – Associate Cloud Security Engineer	GCP Cloud Security Engineer, Google Cloud Security Certification, Google Cloud Associate Security Engineer, Certified Google Cloud Associate – Cloud Security, Google Cloud Security Engineer Certification, Google Cloud Certified - Associate Security Engineer, GCP Cloud Security Certification, GCP Associate Cloud Security Engineer, GCP, Google Associate Cloud Security Engineer Exam, GCP ACE – Associate Cloud Security Engineer
359	Google Cloud Certification – Associate Cloud Network Engineer	GCP Certified Cloud Infrastructure Engineer - Networking Track, Google Cloud Networking Certification, GCP Associate Cloud Network Engineer, Associate-level GCP Network Engineer, GCP Cloud Networking Specialist, Google Cloud Network Engineer, Google Cloud Certified Network Engineer, GCP, GCP Associate-Level Networking Specialist, Google Cloud Associate Network Architect Certification, Google Cloud Network Engineering Certification
360	Google Cloud Certification – Associate Collaboration Engineer	Google Cloud Associate Collaboration Engineer, Google Certified Collaboration Professional, Google Cloud Collaborative Engineer, Google Cloud Certification - Associate Collab Engineer, GSuite Collaboration Engineer Certification, GCP Collab Engineer - Associate Level, GCP Collaboration Engineer, GCP, Google Cloud Associate Collab Engineer Certification, GCCE - Associate Level, GCP Associate Collaboration Specialist
361	Google Cloud Certification – Professional Cloud Architect	GCP Certified Cloud Architect, GCP Cloud Architect Certification, GCP Professional Architect Credential, Google Certified Professional Cloud Architect, GCP Cloud Architecture Specialist, Google Cloud Solutions Architect, GCP Cloud Architecture Expertise, Google Cloud Professional Architect, Google Cloud Platform Architect, Google Professional Cloud Architect Certification, GCP
362	Google Cloud Certification – Professional Cloud Developer	GCP Cloud Development Certification, Google Cloud Developer Certification, Google Professional Cloud Development, GCP Developer Certification, Google Certified Cloud Developer, Certified Google Cloud Developer, Professional Cloud Developer Certification, Google Cloud Professional Developer, GCP, GCP Professional Cloud DevCertification, Google Cloud Platform Developer Certification
363	Google Cloud Certification – Professional Data Engineer	Google Cloud Data Engineering Specialist, GCP Professional Data Engineer Exam, Google Cloud Professional Data Engineer, GCP Data Engineer Certification, Professional Data Engineering Certification by Google Cloud, GCPE - Professional Data Engineering Certification, Certified Google Cloud Data Engineer, Google Cloud Platform - Professional Data Engineer Certificate, GCP, Google Cloud Certified Data Engineer, GCP PDE (Professional Data Engineer) Certification
364	Google Cloud Certification – Professional Cloud DevOps Engineer	Google Cloud Certified – DevOps Engineer, Google Certified Professional – CloudDev Ops Expert, Google Cloud Platform DevOps Engineer Certification, GCP Certified Cloud DevOps Professional, Google Cloud Professional DevOps Certification, Professional Cloud DevOps Engineer Certification by Google, GCP DevOps Specialist, GCP Cloud DevOps Engineer, Google Cloud DevOps Engineer, GCP Professional Cloud DevOps Engineer, GCP
365	Google Cloud Certification – Professional Cloud Security Engineer	Google Cloud Security Engineer, Google Certified Professional in Cloud Security Engineering, GCP-PCSE (Google Certified Professional - Cloud Security Engineer), GCP Security Engineer Certification, Google Cloud Security Specialist, Professional Cloud Security Engineer Certification from Google, GCP, Google Cloud Certified - Cloud Security Professional, GCP Professional Cloud Security Engineer, GCP Cloud Security Architect
366	Google Cloud Certification – Professional Cloud Network Engineer	Professional Cloud Networking Engineer - GCP, GCP Cloud Network Engineer, Google Certified Network Engineer, Google Cloud Professional Networking Certification, Professional-level Network Engineer on Google Cloud Platform (GCP), GCP Cloud Network Specialist, Google Cloud Network Certification, GCP, GCP Cloud Networking Architect, Google Certified Professional for Cloud Networking, GCP Certified Cloud Network Engineer
367	Google Cloud Certification – Professional Collaboration Engineer	Google Cloud Certified - Collaboration Engineer, Google Cloud Pro Collab Engineer, GCP Collaboration Engineer Certification, Google Cloud Collaboration Engineer, GCP Professional Collaboration Engineer, Professional Collaboration Engineer (GCP), GCP Collaborative Engineering Certification, Google Collaboration Engineer Certification, GCP Collab Engineering Certification, GCP, Google Professional Collaboration Engineer Credential
368	Google Cloud Certification – G Suite	Google Cloud Collaboration Certification, G Suite Administrator Certification, Google Workspace Certified Professional, Google Cloud Productivity Certification, G Suite Implementation Expert, G Suite Integration Engineer, Google G Suite Certification, Google Cloud G Suite Specialist, G Suite Certified Professional, GCP, G Suite Deployment Specialist
