unique_id	Level 2	alternative_names_clean
249	JUnit	Test automation tool for Java,, Testing utility for Java, Java testing framework, Java test runner, Java testing library, Testing tool for Java,, Java unit testing framework, Unit testing framework for Java,
250	Elasticsearch	Real-time distributed search and analytics engine, Elastic, Elastic Search, Full-text search and analytics engine by Elastic NV, Distributed search and analytics engine, ES, Open-source distributed full-text search and analytics engine, ES search engine
251	IBM DB2	DB2, IBM's relational database management system, DB2 by IBM, IBM Database 2, IBM's data server software, IBM's database solution, DB2 Database Management System, IBM's DB2, RDBMS from IBM, DBMS by IBM
252	HubSpot software	HubSpot automation tool, HubSpot marketing software, HubSpot CRM, HubSpot platform, HubSpot sales software, HubSpot lead generation software, HubSpot customer relationship management tool, HubSpot, HubSpot analytics tool, HubSpot inbound marketing software
253	Amazon DynamoDB	Amazon's NoSQL database service, DynamoDB, AWS DynamoDB, NoSQL data store by AWS, Fully managed database by Amazon Web Services (AWS), Serverless database offering by Amazon, High-performance distributed database by Amazon, Amazon's managed database service, Scalable database by Amazon, Amazon's cloud-based database solution
254	Apache Subversion SVN	SVN software, Subversion, Apache's code management tool, SVN versioning system, Subversion repository manager, Subversion source control system, Version control system by Apache, Apache SVN, SVN, Apache's version control software
255	Cisco Webex	Video conferencing by Cisco, Webex conferencing solution, Cisco's collaboration tool, Online collaboration using Webex, Webex, Cisco's online meeting platform, Cisco's web collaboration tool, Webex communication software
256	Redis	Open-source in-memory data structure store, In-memory data store
257	Alteryx software	Advanced analytics software by Alteryx, Alteryx platform, Alteryx workflow application, Alteryx, Alteryx data processing software, Data analytic software by Alteryx, Alteryx program, Self-service data preparation software, Alteryx tool
258	AJAX	Interactive web application enhancement, Ajax technology, XMLHttpRequest method, Asynchronous JavaScript and XML, Server communication in web development, Client-side scripting technique, Ajax toolkit/library, Web 2.0 technology, Dynamic HTML and JavaScript
259	Oracle Database	Oracle DBMS, Oracle DB, Oracle's data management solution, Oracle database software, Oracle relational database, Oracle RDBMS, Oracle data storage system, Database by Oracle Corporation, Oracle SQL database
260	Eclipse IDE	Eclipse coding editor, Eclipse development tool, Java IDE by Eclipse, Eclipse, IDE by Eclipse Foundation, Eclipse platform, Eclipse programming environment, Java development tool by Eclipse, Eclipse Integrated Development Environment, Eclipse software
261	GraphQL	Graph QL, Graph Query Language, API query language, Graph-based query language, Data retrieval language, Query Language for APIs
262	Hibernate ORM	ORM solution provided by Hibernate, Object-Relational Mapping tool by Hibernate, Hibernate, Entity mapping framework - Hibernate, Hibernate's database mapping tool, Hibernate's object-persistence framework, Hibernate's data access technology, Persistence framework by Hibernate, ORM framework by Hibernate
263	Oracle SQL Developer	Oracle Developer, Oracle SQL Tool, Oracle SQL Workbench, Oracle Query Tool, SQL Developer, SQL Dev, Oracle Database Developer, Database Development Tool by Oracle, Oracle Dev, Oracle SQL IDE
264	Microsoft Active Server Pages ASP	Microsoft's dynamic web page technology, ASP, ASP technology, ASP web development framework, Server-side scripting using ASP, Microsoft ASP, Microsoft's server-side scripting language, Microsoft's web application framework, Active Server Pages, ASP.NET
265	Bentley MicroStation	Bentley's 3D modeling tool, MicroStation by Bentley, MicroStation design tool, Bentley software, Bentley CAD software, MicroStation program, CAD program by Bentley Systems, MicroStation, Bentley's design software, MicroStation application
266	Apache Tomcat	Tomcat, Tomcat application server, Apache's web hosting software, Apache's Tomcat, Java servlet container by Apache, Tomcat web server, Apache's application container, Tomcat HTTP server, Apache's Java-based web application deployment tool
267	Adobe Systems Adobe Acrobat	Adobe's document viewer, Adobe's document management tool, Adobe's PDF editor, Adobe PDF application, Acrobat, PDF software by Adobe, PDF program by Adobe, Acrobat software by Adobe Systems, Adobe Acrobat Pro, Acrobat Reader
268	Teradata Database	Teradata data warehouse solution, Teradata, Teradata database software, TD database, TDB, Teradata Analytics Platform, Teradata Vantage., Teradata DB, Teradata RDBMS
269	Facebook	Social networking site by Zuckerberg, Zuckerberg's digital network, Online social networking service by Zuckerberg, Zuckerberg's online community, FB, Mark Zuckerberg's social media platform, FB app
270	Autodesk AutoCAD Civil 3D	Civil 3D, Autodesk's 3D modeling software for civil engineering, Autodesk's 3D mapping and infrastructure design tool, AutoCAD's civil engineering tool, AutoCAD Civil, Autodesk's CAD solution for civil design, Autodesk's Civil Design software, AutoCAD Civil 3D, AutoCAD's civil modeling application, Civil design software by Autodesk
271	IBM SPSS Statistics	SPSS analytics platform, IBM's data analysis program, IBM SPSS, IBM's statistical software, SPSS software suite, SPSS Statistics, SPSS analysis tool, SPSS, Statistical Package for the Social Sciences, IBM's statistical data tool
272	Adobe Systems Adobe After Effects	Post-production software by Adobe Systems, AE, Animation and compositing software by Adobe Systems, Video editing tool by Adobe Systems, Adobe After Effects, After Effects, After Effects software, Adobe's video effects program, Adobe's motion graphics and visual effects software
273	UNIX Shell	Unix shell programming, Bash scripting, Shell scripting language, Shell commands, Command line interface in Unix, Unix command interpreter, Linux shell scripting, Shell scripting, Shell scripting in operating systems, Terminal commands
274	Red Hat OpenShift	Red Hat's cloud-native application platform, Red Hat's Kubernetes distribution, OpenShift, RH OpenShift, OpenShift platform, Red Hat's container platform, Red Hat's OpenShift, OpenShift by Red Hat, Containerization platform by Red Hat
275	LinkedIn	
276	Objective C	Mac development language, Objective-C, Apple's object-oriented language, ObjC, Development with Objective-C, iOS development language, Object-oriented programming for iOS and Mac OS X, Apple's programming language
277	Trimble SketchUp Pro	3D modeling program by Trimble, SketchUp software, SketchUp Pro, Trimble SketchUp, SketchUp program, Trimble's architectural design tool, Trimble's professional design tool, SketchUp Pro version by Trimble, Trimble's drafting software, 3D modeling software by Trimble
278	Oracle Primavera Enterprise Project Portfolio Management	Primavera P6, Primavera EPPM, Oracle PPM, Oracle project management software, Primavera PPM, Oracle Primavera, Oracle's enterprise project management software, Primavera project portfolio management solution, Oracle's project planning and scheduling tool, Primavera Enterprise Project Portfolio Management
279	Django	Python's web application framework, Python web framework, Python's MVC framework
280	Drupal	
281	Marketo Marketing Automation	Marketing campaign automation tool by Marketo, Marketo software, Marketing automation system by Marketo, Automation software for marketing by Marketo, Marketing Automation tool by Marketo, Marketo's digital marketing automation software, Marketo's automated marketing solution, Marketo's marketing automation platform, Marketo, Marketo's CRM automation tool
282	Microsoft Dynamics	Dynamics software, Dynamics CRM, Microsoft's customer relationship management software, Dynamics 365, Microsoft Business Solutions, Dynamics platform, Microsoft CRM, Enterprise resource planning (ERP) software by Microsoft, CRM system by Microsoft
283	Epic Systems	Epic EHR, Electronic health record solution from Epic, Epic, Epic EMR, Epic software, Epic electronic health record system, Epic healthcare system, Epic's integrated health record software
284	Google Docs	Google's word processing program, Google's document editor, Google Sheets, GDocs, Google's collaborative writing tool, Online document tool by Google, Web-based document software from Google, Document collaboration platform by Google, Google Drive, Docs by Google
285	Atlassian Bamboo	Automated build and release management system from Atlassian, Bamboo, Bamboo software, Continuous integration tool by Atlassian, Atlassian's continuous delivery solution, CI/CD platform from Atlassian, Build automation software by Atlassian, Atlassian's deployment tool, Atlassian's CI/CD tool, Bamboo build server
286	Oracle JavaServer Pages JSP	Oracle JSP, JSP, Oracle's dynamic scripting language for web pages, JavaServer Pages technology by Oracle, Java web development with JSP, Oracle's server-side programming language for web applications, JavaServer Pages, Oracle's JSP technology, JSP framework by Oracle
287	IBM WebSphere	IBM application deployment platform, IBM's WebSphere, IBM's middleware technology, WebSphere Application Server, WebSphere, WebSphere software, WebSphere platform by IBM, IBM's integration software, IBM's enterprise solution framework, IBM's application server
288	MicroStrategy	MSTR BI
289	Qlik Tech QlikView	Visualization software by Qlik, Qlik's business intelligence platform, Qlik software, Qlik's visualization tool, Qlik data analysis tool, QV by QlikTech, QlikView, QlikTech, Data analytics software by QlikTech, QlikView program
