unique_id	Level 2	alternative_names_clean
133	Microsoft Excel	Excel, Microsoft's spreadsheet software, Microsoft's electronic spreadsheet tool, Excel program, Spreadsheet program by Microsoft, Microsoft's data analysis tool, Workbook software by Microsoft, MS Office Excel, MS Excel, Spreadsheet application from Microsoft
134	Microsoft Office software	Office software, Microsoft's office applications, MS Office, Microsoft's business software, Office program by Microsoft, Microsoft's document management tools, Microsoft Office suite, Microsoft's productivity suite, Office application suite by Microsoft, Suite of productivity software by Microsoft
135	Microsoft PowerPoint	PowerPoint, Microsoft's slide deck software, PowerPoint program, Slide presentation program, Microsoft's presentation application, MS PowerPoint, PPT, Presentation software by Microsoft, Presentation tool by Microsoft
136	Microsoft Outlook	Outlook program, Outlook software, Email management software by Microsoft, Microsoft's communication tool, Microsoft's email application, Email client by Microsoft, Microsoft's messaging platform, Outlook, MS Outlook
137	Microsoft Word	Microsoft's word processing application, MS Word, Text editor by Microsoft, Word program, Word software, Microsoft's document processor, Document software by Microsoft, Microsoft's text editing tool, Word
138	Structured query language SQL	Structured database query language, SQL programming language, SQL scripting language, Standardized query language, Structured data querying language, SQL, Database management system query language, Query language SQL, Relational database language SQL, Database query language SQL
139	Python	Programming language by Guido van Rossum, Object-oriented scripting language, Scripting language by Guido van Rossum
140	Oracle Java	Java, Java programming language, Oracle's programming language, Oracle's Java, Oracle's application development tool, Object-oriented programming language by Oracle, Software development framework by Oracle, Java software by Oracle, Oracle's development platform, Java platform by Oracle
141	Amazon Web Services AWS software	Amazon's cloud infrastructure service, Amazon Web Services, AWS platform as a service, Amazon's web hosting service, Cloud computing by Amazon, AWS software, Amazon AWS, AWS, AWS platform, Amazon cloud services
142	JavaScript	Front-end programming language, JS scripting language, Web scripting language, ECMAScript, Client-side scripting language, Language used for interactivity on websites, JS, Scripting language for web development, Browser-based programming language, Programming language for dynamic web content
143	SAP software	SAP ERP software, SAP solution, SAP business software, SAP technology stack, SAP platform, SAP application, SAP, Enterprise resource planning by SAP, SAP system
144	Microsoft Azure software	Microsoft's cloud technology, Azure, Microsoft's cloud-based software, Microsoft Azure, Azure software, Azure ecosystem, Microsoft's cloud platform, Azure services, Azure platform, Microsoft's cloud computing solution
145	Microsoft Access	MS Access, Microsoft's database management system, Microsoft database software, Database program by Microsoft, Access, Microsoft's data storage tool, Database application by Microsoft, Access software, Microsoft's relational database software, Access program
146	Linux	Free and open-source software (FOSS), Open-source operating system, Unix-like operating system
147	Hypertext markup language HTML	Web coding language, Web development language, Web design language, HyperText Markup Language, HTML, HTML5, Markup language for the web, HTML code, Hypertext markup code
148	Atlassian JIRA	Atlassian's bug tracking tool., JIRA software, JIRA application, Atlassian's ticketing system, JIRA by Atlassian, Atlassian's project management software, Atlassian's issue tracking system, JIRA platform, JIRA
149	Tableau	
150	Cascading style sheets CSS	CSS framework, Stylesheet language, Styling language for HTML, Cascading stylesheets, CSS, Style sheets, Web styling language, CSS3, Styling technology for webpages
151	Microsoft SharePoint	Collaboration platform by Microsoft, SharePoint software, SharePoint, Content management system by Microsoft, SharePoint program, Microsoft's document management system, Intranet solution by Microsoft, Microsoft's team collaboration tool, MS SharePoint
152	Git	Code repository management software
153	C#	C number sign, C sharp programming platform, Object-oriented language from Microsoft, C sharp language, C hash, .NET language by Microsoft, Language used in .NET development, Programming language similar to Java and C++, C Sharp
154	React	UI development library by Facebook, Front-end framework by Facebook, Declarative JavaScript library, JavaScript library for building user interfaces
155	Google Angular	Angular development platform, Google's Angular, AngularJS by Google, Google's JavaScript framework, Google's front-end framework, Angular software, Angular framework, AngularJS, JavaScript library by Google, Google's web application framework
156	C++	Cplusplus, General-purpose programming language with a bias towards systems programming, C-based object-oriented programming language, CPP, C plus plus, Object-oriented C, High-level programming language for systems development, C language extension, C with classes
157	Docker	D-Tech, Containerization tool
158	Kubernetes	Container orchestration tool, Open-source containerization platform, K8s, Container management framework, Cloud-native application deployment tool, Cluster management system, Kube system
159	R	Scripting language for data analysis and visualization
160	Google Workspace software	G Suite, Google Sheets, Google Docs, Google's productivity suite, Google Slides, Google Drive apps, Cloud-based productivity tools by Google, Google's collaboration tools, Workspace by Google, Google's office software
161	Autodesk AutoCAD	Autodesk's AutoCAD, AutoCAD software, AutoCAD, AutoDesk's drafting tool, 2D and 3D drafting tool by Autodesk, AutoDesk's computer-aided drafting software, AutoCAD program, Computer-aided design software by Autodesk, Autodesk's design and documentation tool, CAD software by Autodesk
162	Microsoft Visio	Visio program, Visio software, Diagramming tool by Microsoft, Visio, Microsoft's visual communication software, Visualization tool by Microsoft, Microsoft's flowcharting and diagramming application, MS Visio
163	Jenkins CI	Jenkins, Build and deployment tool - Jenkins, CI/CD tool by Jenkins, Jenkins continuous integration, Jenkins pipeline tool, Jenkins build server, Automation framework by Jenkins, Continuous integration with Jenkins, CI tool by Jenkins, Jenkins automation server
164	Node.js	Node JavaScript, NodeJS, Node, Server-side runtime for executing JavaScript, Server-side JavaScript framework, Runtime environment for executing JavaScript code server-side, Event-driven I/O server-side platform, JavaScript runtime built on Chrome's V8 engine, Backend JavaScript platform, Platform for building scalable network applications using JavaScript
165	Adobe Systems Adobe Photoshop	Adobe Photoshop, Adobe's digital imaging tool, Adobe's graphic design tool, Image editing software by Adobe Systems, Adobe's photo editing application, Graphic design program by Adobe Systems, Photoshop program by Adobe Systems, Adobe's image editing software, Photoshop software by Adobe Systems, Photoshop
166	Intuit QuickBooks	Intuit's accounting software, QuickBooks by Intuit, Intuit's financial management tool, QuickBooks program, Intuit's bookkeeping application, QuickBooks, QuickBooks online, Financial software by Intuit, Small business accounting solution by Intuit, QuickBooks software
167	UNIX	Unix-like, Unix-like system, Unix environment, Unix-like platform, Unix-based
168	C	Structured high-level language
169	Zoom	
170	Microsoft Active Directory	Windows domain controller, Windows Active Directory, Microsoft AD, Active Directory, Microsoft's directory service, LDAP service by Microsoft, Windows directory service, Microsoft's centralized authentication and authorization framework., AD, Microsoft's identity management system
171	Microsoft Windows	Windows software, Windows operating system, Microsoft software, Microsoft platform, Windows environment, Windows OS, Microsoft OS, Windows platform, Microsoft ecosystem, Microsoft operating system
172	Apple iOS	Apple's smartphone OS, Apple's iOS platform, iPad/iPhone operating system, Mac OS for mobile devices, iPhone operating system, iOS software, Apple's mobile software, Apple's mobile operating system, iOS, iOS ecosystem
173	Microsoft SQL Server	Microsoft's database management system, SQL Server, Relational database management software from Microsoft, SQL Server by Microsoft, Database server software from Microsoft, SQL Server program by Microsoft, Microsoft's data storage and retrieval system, Microsoft's DBMS solution, MS SQL Server, Microsoft's relational database software
174	SAS	Statistical Analysis System
175	Extensible markup language XML	XML data representation, W3C's XML specification, Markup language XML, XML, Data interchange format XML, XML schema language, XML document format, Document structure language XML, eXtensible markup language, Text-based data storage format
176	Microsoft Project	Microsoft's planning application, MS Project, Microsoft's project planning software, Microsoft's task management tool, Project management software by Microsoft, Microsoft's scheduling tool, Project, Microsoft's project management software, Project by Microsoft, Task planner by Microsoft.
177	ServiceNow	Service management software by Now Inc., Enterprise service management solution, SNOW platform, SNOW software
178	NoSQL	non-relational database, document-oriented database, distributed database system without SQL constraints, unstructured data storage solution, non-SQL database, alternative to relational databases, schema-less database
179	Apache Spark	Open-source cluster computing system, Spark platform, Distributed computing engine by Apache, In-memory analytics engine by Apache, Data processing framework by Apache, Big data analytics software by Apache, Real-time data processing framework by Apache, Spark, Apache's big data processing tool
180	Adobe Systems Adobe Illustrator	Adobe's graphic design software, Illustrator software, Adobe's drawing tool, Adobe's illustration program, Illustrator, Graphic design program by Adobe Systems, Adobe Illustrator, Adobe's vector graphics editor, Vector graphics software by Adobe Systems, Drawing application by Adobe
181	JavaScript Object Notation JSON	JSON encoding, JSON syntax, JavaScript data interchange format, JavaScript notation, JavaScript object format, JSON format, JavaScript object representation, JSON serialization, JSON, JSON data structure
182	Microsoft Teams	Communication platform by Microsoft, MS Teams, Microsoft's virtual meeting software, Collaboration tool by Microsoft, Teams, Team messaging app by Microsoft, Group chat application by Microsoft, Microsoft's team collaboration software, Unified communication platform from Microsoft
183	Microsoft PowerShell	Microsoft's command-line shell, Microsoft automation framework, PowerShell scripting, Windows PowerShell, Microsoft's scripting language, PowerShell Core, .NET-based automation and configuration framework by Microsoft, PowerShell, Windows command line tool by Microsoft
184	Apache Kafka	Distributed streaming platform by Apache, Kafka messaging system, Apache's real-time data processing software, Kafka data pipeline tool, Messaging queue by Apache, Kafka event-driven architecture, Event streaming platform by Apache, Kafka, Streaming software by Apache, Apache's messaging platform
185	PostgreSQL	Postgres, PGSQL, PostgresSQL, PGSQ, PostgrSQL, Postgre SQL, Postgresql 
186	Atlassian Confluence	Atlassian's document sharing tool, Atlassian's knowledge management software, Confluence program, Team collaboration software by Atlassian, Atlassian's wiki tool, Confluence, Collaboration tool from Atlassian, Confluence wiki, Wiki platform by Atlassian
187	Ansible software	Ansible solution, Ansible automation platform, Ansible, Infrastructure as code tool by Ansible, Ansible system, Automation software by Ansible, Ansible tool, Configuration management software by Ansible, Ansible framework
188	IBM Terraform	Provisioning tool by IBM for cloud resources, Automation software for deploying infrastructure by IBM, IBM's cloud provisioning software, IBM's deployment automation tool, IBM's infrastructure as code tool, Infrastructure automation tool by IBM, Infrastructure management software from IBM, Terraforming software by IBM, Terraform, Terraform program by IBM
189	Adobe Systems Adobe Creative Cloud software	Adobe's content creation platform, Creative Cloud software, Adobe's graphic design software package, Adobe CC, Adobe's multimedia editing software bundle, Adobe's creative toolset, Adobe Creative Cloud, Design and editing tools by Adobe, Adobe's digital creation suite, Adobe design software suite
190	Go	
191	Microsoft .NET Framework	Microsoft's development environment, .NET platform, Framework by Microsoft for building applications, Development toolset by Microsoft, .NET, Microsoft's application development framework, Microsoft's software framework, Application framework from Microsoft, .NET Framework, Software infrastructure by Microsoft for developing apps
192	GitHub	Git-Hub
193	Workday software	Workforce management system by Workday, Human capital management software by Workday, Workday solution, HR software by Workday, Workday, Workday platform, Workday system, Workday application, Cloud-based HR software by Workday
194	Adobe Systems Adobe InDesign	Publishing software by Adobe Systems, InDesign software, Adobe's desktop publishing software, InDesign program, Document layout program by Adobe, Adobe's layout design tool, Adobe's document design software, InDesign, Desktop publishing application by Adobe Systems, Adobe InDesign
195	Spring Framework	Spring software development kit (SDK), Spring development framework, Spring platform, Java-based enterprise application framework - Spring, Spring application framework, Spring for Java, Spring
196	Apache Hadoop	Apache's Hadoop, Apache's big data platform, Big data processing technology by Apache, MapReduce framework by Apache, Open-source distributed file system, Hadoop ecosystem, Hadoop framework, Hadoop, Apache's data storage and processing tool, Distributed computing system by Apache
197	TypeScript	TS language, TS, Strongly Typed JavaScript, JS with types, Microsoft's typed superset of JavaScript, Typed JavaScript, Typed JS, Type-safe JavaScript
198	Microsoft Windows Server	Microsoft's enterprise operating system, Microsoft's network operating system, Windows Server, MS Windows Server, Windows Server OS, Windows Server edition, Microsoft's server software, Microsoft's server platform, Windows server operating system
199	Bash	Command-line interpreter, Shell programming language, Bourne-Again SHell, Shell, Shell scripting language, Unix shell
200	Ruby	Dynamic scripting language by Yukihiro Matsumoto (Matz), RoR, Open-source object-oriented programming language
201	MongoDB	Mongo, Mongo database
202	Perl	Scripting language by Larry Wall, Larry Wall's programming language, Practical Extraction and Reporting Language
203	eClinicalWorks EHR software	eClinicalWorks electronic health record software, eClinicalWorks EHR system, eCW software, eClinicalWorks EMR solution, Electronic health records software by eClinicalWorks, eClinicalWorks EHR application, eCW electronic medical record system, eCW EHR platform, Electronic records management software by eCW, eClinicalWorks healthcare technology
204	Splunk Enterprise	Splunk platform, Splunk, Enterprise monitoring and analysis tool by Splunk, Splunk's log management solution, Splunk's data analytics tool, Log analysis software by Splunk, Splunk software, Real-time data processing platform by Splunk
205	jQuery	Lightweight JavaScript library for HTML document traversal and manipulation, JavaScript library by John Resig, Popular JavaScript library for DOM manipulation
206	Spring Boot	Spring's microservices framework, Simplified application development using Spring, Spring's Boot, Spring's lightweight web development framework, Java framework by Spring, Java-based web application framework by Pivotal Software, Spring-based application development tool, Bootstrapping with Spring, SpringBoot, Spring framework Boot
207	PHP	
208	The MathWorks MATLAB	MATLAB program, MATLAB, MathWorks' computational tool, MathWorks' numerical computing environment, MATLAB programming language, MATLAB software, MATLAB scripting language, MathWorks MATLAB, Numerical analysis software by The MathWorks, The MathWorks' software for scientific computing
209	Autodesk Revit	Building Information Modeling (BIM) software by Autodesk, BIM design tool by Autodesk, 3D modeling software for architects and engineers by Autodesk, Revit Structure, Revit MEP, Autodesk's construction modeling software, Revit Architecture, Revit
210	Yardi software	Yardi, Software developed by Yardi Systems, Real estate management tool by Yardi, Yardi platform, Yardi's industry-leading software, Property management software by Yardi, Yardi's software suite, Yardi program, Yardi application
211	Amazon Simple Storage Service S3	AWS S3, Amazon S3, Amazon's storage service, S3 storage, Amazon's object storage service, Amazon's cloud storage solution, S3, Simple Storage Service, Amazon's file hosting service
212	Oracle Java 2 Platform Enterprise Edition J2EE	Oracle's server-side Java technology, Oracle Java Enterprise Edition, Java 2 Platform EE, Oracle's J2EE platform, Oracle's enterprise Java platform, Java EE application development, J2EE, Java enterprise development kit (JDK), JavaEE, JEE framework
213	Scala	
214	WordPress	Website development tool by Automattic, WP CMS, WP blogging platform, WP, WP website builder
215	Slack	Business messaging app
216	Apache Maven	Apache's build configuration tool, Maven project management tool, Apache's project management and comprehension tool, Dependency management tool by Apache, Apache's software for project building and management, Apache's build tool, Maven build tool, Maven software, Build automation framework by Apache, Maven
217	Dassault Systemes SolidWorks	3D modeling software by Dassault Systemes, DS SolidWorks, Dassault SolidWorks, 3D design software from Dassault, SolidWorks engineering software, SolidWorks CAD software, Dassault's mechanical design software, Dassault's SolidWorks program, Solid modeling tool by Dassault Systemes, SolidWorks
218	Selenium	
219	Microsoft ASP.NET	Microsoft's web programming technology, .NET-based web development platform by Microsoft, .NET Framework for web development, ASPNET, Web development using Microsoft technologies, ASP.NET Core, Web application development using Microsoft tools and libraries, Microsoft's server-side framework for building dynamic websites, Microsoft's web application framework, ASP.NET
220	Chef	
221	Google Cloud software	Google Cloud Platform, Software from Google for cloud computing, Google's cloud technology solution, GCP, Google Cloud, Google's cloud infrastructure, Cloud services by Google, Cloud software developed by Google, Google's cloud software suite, Google's cloud computing platform
222	Microsoft SQL Server Integration Services SSIS	Integration Services by Microsoft, SSIS package development tool, SQL Server SSIS, SSIS, SSIS platform by Microsoft, Data integration software by Microsoft, Microsoft's data flow tool, Microsoft's ETL tool, SQL Server Integration Services
223	Shell script	Scripting in the shell, Shell automation, Bash script, Shell program, Command-line scripting, Unix shell script, Shell command language, Shell programming
224	Oracle PL/SQL	Oracle's procedural language extension for SQL, PL/SQL, PLSQL development tool by Oracle, Oracle's query language, Oracle programming language, Programming language used in Oracle databases, PL-SQL, Procedural SQL for Oracle database management system, Oracle's database programming language, Oracle PL SQL code
225	Swift	Apple's modern programming language, iOS development language by Apple
226	Microsoft Visual Studio	VS, Integrated development environment from Microsoft, Microsoft's IDE, Visual Studio, Visual Studio Code editor, Visual Studio programming tool, Microsoft's software development platform, Development software by Microsoft, MS Visual Studio
227	Vue.js	Vuejs, JavaScript framework by Evan You, Vue library, Reactive JavaScript framework, Vue, Vue web development tool
228	Amazon Elastic Compute Cloud EC2	EC2, Amazon's elastic computing platform, Cloud compute instances by Amazon, AWS EC2, Amazon's cloud hosting service, EC2 instances, Amazon's virtual server service, Elastic Compute Cloud, Amazon EC2
229	Microsoft SQL Server Reporting Services SSRS	SQL Server report generator, Reporting Services by Microsoft, Microsoft SSRS, Microsoft's data visualization solution, Microsoft's reporting tool, SSRS software, SSRS tool, SQL Server RS, SQL Server Reporting Services, SSRS
230	Puppet	
231	Apple macOS	Mac operating system, Apple's desktop platform, macOS operating environment, Macintosh operating system, Apple's computer software, macOS software suite, macOS software, Apple operating system, macOS, Apple OS X
232	Atlassian Bitbucket	Bitbucket, Bitbucket server, Bitbucket software, Atlassian's version control system, Atlassian's code hosting platform, Bitbucket application, Git repository management tool by Atlassian, Source code management tool by Atlassian, Version control solution by Atlassian
233	GitLab	Git hosting service, Git repository manager, Code management software, Git Lab, Git-based collaboration platform
234	Ruby on Rails	Rails programming language, Ruby web development framework, Ruby framework, Ruby's full-stack framework, RoR, Rails, Ruby's web development toolset, Rails web development platform., Ruby's MVC framework
235	Apache Hive	Hive, Distributed data warehousing framework by Apache, HiveQL, Big data processing tool by Apache, Data warehouse infrastructure on Hadoop, Data querying and analysis tool by Apache, Hadoop Hive, SQL-like interface for Hadoop, Hive query language
236	Kronos Workforce Timekeeper	Kronos Workforce, Kronos, Employee time tracking system by Kronos, Kronos workforce management solution, Timekeeping software by Kronos, Workforce management tool by Kronos, Kronos Timekeeper, Attendance management software by Kronos, Workforce Timekeeper, Kronos scheduling and attendance software
237	Amazon Web Services AWS CloudFormation	AWS CloudFormation, AWS infrastructure deployment tool, AWS stack deployment service, AWS resource management tool, Amazon CloudFormation, CloudFormation service by AWS, Amazon CF, AWS CF, Amazon's infrastructure as code service, CloudFormation by Amazon Web Services
238	Bootstrap	Responsive web design framework by Twitter, HTML/CSS/JS library developed by Twitter, Twitter's web development framework, Front-end framework by Twitter, CSS framework by Twitter, UI development toolkit by Twitter
239	Amazon Redshift	AWS Red Shift, Amazon Red Shift, Amazon's data warehousing solution, Amazon's cloud-based data warehouse, Redshift, Data warehouse service by Amazon, Redshift analytics platform, Cloud-based data warehousing by Amazon., AWS Redshift, Redshift database
240	Informatica software	Informatica data integration software, Informatica Big Data Integration, Informatica Cloud, Informatica platform, Informatica PowerCenter, Informatica ETL tool, Informatica Data Quality, Informatica Intelligent Data Integration, Informatica Master Data Management (MDM), Informatica
241	Transact-SQL	SQL programming, Transact Structured Query Language, SQL Server, Microsoft's query language, Microsoft's data manipulation language, T-SQL commands, Microsoft's database programming language, Database querying with T-SQL, T-SQL
242	Microsoft Visual Basic	VB, VBA (Visual Basic for Applications), VB.NET, Microsoft's Visual Basic development tool, MS Visual Basic, VBScript (a variant of Visual Basic), Visual Basic, Microsoft VB, Visual Basic programming language, Microsoft's object-oriented programming language.
243	Apache Cassandra	Distributed storage and management system by Apache, Cassandra, Apache's highly available database system, Cassandra DBMS, Cassandra database system, Apache's distributed database, Scalable and fault-tolerant database by Apache, Apache's scalable NoSQL solution, Open-source distributed data store by Apache, NoSQL database by Apache
244	ESRI ArcGIS software	Geographic Information System by ESRI, Geographic analysis software by ESRI, ESRI software, ESRI mapping tool, ArcGIS software, ArcGIS mapping software, Mapping program by ESRI, ArcGIS, ESRI's GIS application
245	Microsoft Visual Basic for Applications VBA	Visual Basic for Applications by Microsoft, Microsoft's automation and customization technology, VBA coding language, Microsoft's macro development tool, Microsoft Visual Basic, Visual Basic for Applications, VBA programming language, VBA, VBA scripting language, Microsoft VBA
246	Google Sheets	Spreadsheet software by Google, Sheets, Google's data analysis tool, Google's online spreadsheet application, Sheets program by Google, Online spreadsheet tool from Google, Google's workbook program, Google's spreadsheet tool
247	Figma	
248	Microsoft Team Foundation Server	Microsoft TFS, Team Foundation Server, Team Foundation Services, Microsoft's application lifecycle management tool, ALM tool by Microsoft, Application lifecycle management solution by Microsoft, Microsoft's collaboration platform for software development, Microsoft's source control and project management software, TFS by Microsoft, TFS
